{"$id":"waywarden.inventory/v1","$schema":"https://json-schema.org/draft/2020-12/schema","additionalProperties":false,"properties":{"backups":{"items":{"additionalProperties":false,"properties":{"backup_set_id":{"type":"string"},"installation_id":{"type":"string"},"verified":{"type":"boolean"}},"required":["backup_set_id","installation_id","verified"],"type":"object"},"type":"array"},"blockers":{"items":{"additionalProperties":false,"properties":{"code":{"type":"string"},"message":{"type":"string"},"severity":{"type":"string"}},"required":["code","severity","message"],"type":"object"},"type":"array"},"deployments":{"items":{"additionalProperties":false,"properties":{"deployment_id":{"type":"string"},"governed_path":{"type":"string"},"governed_slot_identity":{"type":"string"},"link_strategy":{"type":"string"},"runtime_bindings":{"items":{"additionalProperties":false,"properties":{"deployment_id":{"type":"string"},"name":{"type":"string"},"root":{"type":"string"},"runtime":{"type":"string"},"target":{"type":"string"}},"required":["deployment_id","runtime","root","name","target"],"type":"object"},"type":"array"},"skill_id":{"type":"string"},"source_identity":{"type":"string"},"source_path":{"type":"string"}},"required":["deployment_id","skill_id","source_path","source_identity","governed_path","governed_slot_identity","link_strategy","runtime_bindings"],"type":"object"},"type":"array"},"manifest_digest":{"pattern":"^[0-9a-f]{64}$","type":"string"},"ownership":{"items":{"additionalProperties":false,"properties":{"aggregate_event":{"type":"string"},"installation_id":{"type":"string"}},"required":["installation_id","aggregate_event"],"type":"object"},"type":"array"},"runtime_bindings":{"items":{"additionalProperties":false,"properties":{"deployment_id":{"type":"string"},"name":{"type":"string"},"root":{"type":"string"},"runtime":{"type":"string"},"target":{"type":"string"}},"required":["deployment_id","runtime","root","name","target"],"type":"object"},"type":"array"},"schema":{"const":"waywarden.inventory/v1","type":"string"},"sources":{"items":{"additionalProperties":false,"properties":{"path":{"type":"string"},"sha256":{"pattern":"^[0-9a-f]{64}$","type":"string"},"skill_id":{"type":"string"},"source_identity":{"type":"string"}},"required":["skill_id","path","source_identity","sha256"],"type":"object"},"type":"array"}},"required":["schema","manifest_digest","sources","deployments","runtime_bindings","ownership","backups","blockers"],"type":"object"}