{"backups":[{"backup_set_id":"backup-observed-001","installation_id":"installation-observed-001","verified":true}],"blockers":[],"deployments":[{"deployment_id":"9fd207a11f20bafd1e31ebdfc93990ef1cf34322d6755cc978fc1c2ef51fa51a","governed_path":"/tmp/waywarden-home/.agents/skills/adr","governed_slot_identity":"/tmp/waywarden-home/.agents/skills/adr","link_strategy":"direct_symlink","runtime_bindings":[{"deployment_id":"9fd207a11f20bafd1e31ebdfc93990ef1cf34322d6755cc978fc1c2ef51fa51a","name":"adr","root":"/tmp/waywarden-home/.agents/skills","runtime":"opencode","target":"/tmp/waywarden-home/.agents/skills/adr/SKILL.md"},{"deployment_id":"9fd207a11f20bafd1e31ebdfc93990ef1cf34322d6755cc978fc1c2ef51fa51a","name":"adr","root":"/tmp/waywarden-home/.agents/skills","runtime":"pi","target":"/tmp/waywarden-home/.agents/skills/adr/SKILL.md"}],"skill_id":"adr","source_identity":"/tmp/waywarden-repo/skills/adr","source_path":"skills/adr"},{"deployment_id":"033bc31c463554957d74f5542e94699bae46543c55fe0c03d9271692cbdb3ea0","governed_path":"/tmp/waywarden-home/.agents/skills/decision-calibrator","governed_slot_identity":"/tmp/waywarden-home/.agents/skills/decision-calibrator","link_strategy":"direct_symlink","runtime_bindings":[{"deployment_id":"033bc31c463554957d74f5542e94699bae46543c55fe0c03d9271692cbdb3ea0","name":"decision-calibrator","root":"/tmp/waywarden-home/.agents/skills","runtime":"opencode","target":"/tmp/waywarden-home/.agents/skills/decision-calibrator/SKILL.md"},{"deployment_id":"033bc31c463554957d74f5542e94699bae46543c55fe0c03d9271692cbdb3ea0","name":"decision-calibrator","root":"/tmp/waywarden-home/.agents/skills","runtime":"pi","target":"/tmp/waywarden-home/.agents/skills/decision-calibrator/SKILL.md"}],"skill_id":"decision-calibrator","source_identity":"/tmp/waywarden-repo/skills/decision-calibrator","source_path":"skills/decision-calibrator"},{"deployment_id":"e2b60949eb1ebdbfb413779f38cf0f5d31d64161f4d007d2c7c95339707975dd","governed_path":"/tmp/waywarden-home/.agents/skills/model-optimizer","governed_slot_identity":"/tmp/waywarden-home/.agents/skills/model-optimizer","link_strategy":"direct_symlink","runtime_bindings":[{"deployment_id":"e2b60949eb1ebdbfb413779f38cf0f5d31d64161f4d007d2c7c95339707975dd","name":"model-optimizer","root":"/tmp/waywarden-home/.agents/skills","runtime":"opencode","target":"/tmp/waywarden-home/.agents/skills/model-optimizer/SKILL.md"},{"deployment_id":"e2b60949eb1ebdbfb413779f38cf0f5d31d64161f4d007d2c7c95339707975dd","name":"model-optimizer","root":"/tmp/waywarden-home/.agents/skills","runtime":"pi","target":"/tmp/waywarden-home/.agents/skills/model-optimizer/SKILL.md"}],"skill_id":"model-optimizer","source_identity":"/tmp/waywarden-repo/skills/model-optimizer","source_path":"skills/model-optimizer"},{"deployment_id":"3c224075ad1073aaea61a80fd94870d7f222c909a3675c9875f2832fc1430887","governed_path":"/tmp/waywarden-home/.agents/skills/remove-gentle-context","governed_slot_identity":"/tmp/waywarden-home/.agents/skills/remove-gentle-context","link_strategy":"direct_symlink","runtime_bindings":[{"deployment_id":"3c224075ad1073aaea61a80fd94870d7f222c909a3675c9875f2832fc1430887","name":"remove-gentle-context","root":"/tmp/waywarden-home/.agents/skills","runtime":"opencode","target":"/tmp/waywarden-home/.agents/skills/remove-gentle-context/SKILL.md"},{"deployment_id":"3c224075ad1073aaea61a80fd94870d7f222c909a3675c9875f2832fc1430887","name":"remove-gentle-context","root":"/tmp/waywarden-home/.agents/skills","runtime":"pi","target":"/tmp/waywarden-home/.agents/skills/remove-gentle-context/SKILL.md"}],"skill_id":"remove-gentle-context","source_identity":"/tmp/waywarden-repo/skills/remove-gentle-context","source_path":"skills/remove-gentle-context"},{"deployment_id":"3f39e318ae3a7ba0b7e9007a2d3b6d1e08db94d26dd9316caa97d722aad8d7a0","governed_path":"/tmp/waywarden-home/.agents/skills/systemic-issue-triage","governed_slot_identity":"/tmp/waywarden-home/.agents/skills/systemic-issue-triage","link_strategy":"direct_symlink","runtime_bindings":[{"deployment_id":"3f39e318ae3a7ba0b7e9007a2d3b6d1e08db94d26dd9316caa97d722aad8d7a0","name":"systemic-issue-triage","root":"/tmp/waywarden-home/.agents/skills","runtime":"opencode","target":"/tmp/waywarden-home/.agents/skills/systemic-issue-triage/SKILL.md"},{"deployment_id":"3f39e318ae3a7ba0b7e9007a2d3b6d1e08db94d26dd9316caa97d722aad8d7a0","name":"systemic-issue-triage","root":"/tmp/waywarden-home/.agents/skills","runtime":"pi","target":"/tmp/waywarden-home/.agents/skills/systemic-issue-triage/SKILL.md"}],"skill_id":"systemic-issue-triage","source_identity":"/tmp/waywarden-repo/skills/systemic-issue-triage","source_path":"skills/systemic-issue-triage"},{"deployment_id":"95c128e372c7c7f9ba440d243e92c4967e94a0dd9cf1345dd9bb231d7b1c1e45","governed_path":"/tmp/waywarden-home/.claude/skills/adr","governed_slot_identity":"/tmp/waywarden-home/.claude/skills/adr","link_strategy":"direct_symlink","runtime_bindings":[{"deployment_id":"95c128e372c7c7f9ba440d243e92c4967e94a0dd9cf1345dd9bb231d7b1c1e45","name":"adr","root":"/tmp/waywarden-home/.claude/skills","runtime":"claude","target":"/tmp/waywarden-home/.claude/skills/adr/SKILL.md"}],"skill_id":"adr","source_identity":"/tmp/waywarden-repo/skills/adr","source_path":"skills/adr"},{"deployment_id":"a2df3d5ad3956e32f181d4174bc48b3b16307fdeec9d2a8e7bc1659d90cf903c","governed_path":"/tmp/waywarden-home/.claude/skills/decision-calibrator","governed_slot_identity":"/tmp/waywarden-home/.claude/skills/decision-calibrator","link_strategy":"direct_symlink","runtime_bindings":[{"deployment_id":"a2df3d5ad3956e32f181d4174bc48b3b16307fdeec9d2a8e7bc1659d90cf903c","name":"decision-calibrator","root":"/tmp/waywarden-home/.claude/skills","runtime":"claude","target":"/tmp/waywarden-home/.claude/skills/decision-calibrator/SKILL.md"}],"skill_id":"decision-calibrator","source_identity":"/tmp/waywarden-repo/skills/decision-calibrator","source_path":"skills/decision-calibrator"},{"deployment_id":"30bac04c94e106656687c95ebbe92dc96d3f123a58de948b866f6ab682d120ec","governed_path":"/tmp/waywarden-home/.claude/skills/model-optimizer","governed_slot_identity":"/tmp/waywarden-home/.claude/skills/model-optimizer","link_strategy":"direct_symlink","runtime_bindings":[{"deployment_id":"30bac04c94e106656687c95ebbe92dc96d3f123a58de948b866f6ab682d120ec","name":"model-optimizer","root":"/tmp/waywarden-home/.claude/skills","runtime":"claude","target":"/tmp/waywarden-home/.claude/skills/model-optimizer/SKILL.md"}],"skill_id":"model-optimizer","source_identity":"/tmp/waywarden-repo/skills/model-optimizer","source_path":"skills/model-optimizer"},{"deployment_id":"972555ce8622fe3f7956e3fb0e20a1e06b8b85a4260ac36c7d94e5f84c4bc160","governed_path":"/tmp/waywarden-home/.claude/skills/remove-gentle-context","governed_slot_identity":"/tmp/waywarden-home/.claude/skills/remove-gentle-context","link_strategy":"direct_symlink","runtime_bindings":[{"deployment_id":"972555ce8622fe3f7956e3fb0e20a1e06b8b85a4260ac36c7d94e5f84c4bc160","name":"remove-gentle-context","root":"/tmp/waywarden-home/.claude/skills","runtime":"claude","target":"/tmp/waywarden-home/.claude/skills/remove-gentle-context/SKILL.md"}],"skill_id":"remove-gentle-context","source_identity":"/tmp/waywarden-repo/skills/remove-gentle-context","source_path":"skills/remove-gentle-context"},{"deployment_id":"fc8ab2bfd2e120d0208e4c70df3e2c380e47d6740df5cf39c27d35cb5087a7d0","governed_path":"/tmp/waywarden-home/.claude/skills/systemic-issue-triage","governed_slot_identity":"/tmp/waywarden-home/.claude/skills/systemic-issue-triage","link_strategy":"direct_symlink","runtime_bindings":[{"deployment_id":"fc8ab2bfd2e120d0208e4c70df3e2c380e47d6740df5cf39c27d35cb5087a7d0","name":"systemic-issue-triage","root":"/tmp/waywarden-home/.claude/skills","runtime":"claude","target":"/tmp/waywarden-home/.claude/skills/systemic-issue-triage/SKILL.md"}],"skill_id":"systemic-issue-triage","source_identity":"/tmp/waywarden-repo/skills/systemic-issue-triage","source_path":"skills/systemic-issue-triage"}],"manifest_digest":"88c7275ef3ef13f6eb8bf6a201c972557ab952d4d6ebe115ca80d40a1c9b64c3","ownership":[{"aggregate_event":"removed_verified","installation_id":"installation-observed-001"}],"runtime_bindings":[{"deployment_id":"95c128e372c7c7f9ba440d243e92c4967e94a0dd9cf1345dd9bb231d7b1c1e45","name":"adr","root":"/tmp/waywarden-home/.claude/skills","runtime":"claude","target":"/tmp/waywarden-home/.claude/skills/adr/SKILL.md"},{"deployment_id":"a2df3d5ad3956e32f181d4174bc48b3b16307fdeec9d2a8e7bc1659d90cf903c","name":"decision-calibrator","root":"/tmp/waywarden-home/.claude/skills","runtime":"claude","target":"/tmp/waywarden-home/.claude/skills/decision-calibrator/SKILL.md"},{"deployment_id":"30bac04c94e106656687c95ebbe92dc96d3f123a58de948b866f6ab682d120ec","name":"model-optimizer","root":"/tmp/waywarden-home/.claude/skills","runtime":"claude","target":"/tmp/waywarden-home/.claude/skills/model-optimizer/SKILL.md"},{"deployment_id":"972555ce8622fe3f7956e3fb0e20a1e06b8b85a4260ac36c7d94e5f84c4bc160","name":"remove-gentle-context","root":"/tmp/waywarden-home/.claude/skills","runtime":"claude","target":"/tmp/waywarden-home/.claude/skills/remove-gentle-context/SKILL.md"},{"deployment_id":"fc8ab2bfd2e120d0208e4c70df3e2c380e47d6740df5cf39c27d35cb5087a7d0","name":"systemic-issue-triage","root":"/tmp/waywarden-home/.claude/skills","runtime":"claude","target":"/tmp/waywarden-home/.claude/skills/systemic-issue-triage/SKILL.md"},{"deployment_id":"9fd207a11f20bafd1e31ebdfc93990ef1cf34322d6755cc978fc1c2ef51fa51a","name":"adr","root":"/tmp/waywarden-home/.agents/skills","runtime":"opencode","target":"/tmp/waywarden-home/.agents/skills/adr/SKILL.md"},{"deployment_id":"033bc31c463554957d74f5542e94699bae46543c55fe0c03d9271692cbdb3ea0","name":"decision-calibrator","root":"/tmp/waywarden-home/.agents/skills","runtime":"opencode","target":"/tmp/waywarden-home/.agents/skills/decision-calibrator/SKILL.md"},{"deployment_id":"e2b60949eb1ebdbfb413779f38cf0f5d31d64161f4d00